Folder	DocID	QueryID	Split	Query	first	third	datasecurity	dataretention	user_access	user_choice	other
../../Dataset/Train/com.herocraft.game.farmfrenzy.freemium	Farm Frenzy Free: Time management game _7	Farm Frenzy Free: Time management game _7_42	train	do you use facebook to login?                        	1	0	0	0	0	0	0
../../Dataset/Train/com.herocraft.game.farmfrenzy.freemium	Farm Frenzy Free: Time management game _7	Farm Frenzy Free: Time management game _7_43	train	is my password and information kept encrypted?                          	0	0	1	0	0	0	0
../../Dataset/Train/com.herocraft.game.farmfrenzy.freemium	Farm Frenzy Free: Time management game _7	Farm Frenzy Free: Time management game _7_44	train	are there any targeted advertisements?	1	1	0	0	0	0	0
../../Dataset/Train/com.herocraft.game.farmfrenzy.freemium	Farm Frenzy Free: Time management game _7	Farm Frenzy Free: Time management game _7_45	train	will my data be saved permanently?                             	0	0	0	1	0	0	0
../../Dataset/Train/com.herocraft.game.farmfrenzy.freemium	Farm Frenzy Free: Time management game _7	Farm Frenzy Free: Time management game _7_46	train	what sort of data will be transmitted?                                                	1	1	0	0	0	0	0
../../Dataset/Train/com.herocraft.game.farmfrenzy.freemium	Farm Frenzy Free: Time management game _7	Farm Frenzy Free: Time management game _7_47	train	will i be able to adjust my privacy settings?        	0	0	0	0	0	1	0
../../Dataset/Train/com.herocraft.game.farmfrenzy.freemium	Farm Frenzy Free: Time management game _7	Farm Frenzy Free: Time management game _7_48	train	can i enable/disable data tracking by the application?                  	0	0	0	0	0	1	0
../../Dataset/Train/com.herocraft.game.farmfrenzy.freemium	Farm Frenzy Free: Time management game _7	Farm Frenzy Free: Time management game _7_49	train	will my location be tracked and collected continuously?	1	0	0	0	0	0	0
../../Dataset/Train/com.imdb.mobile	IMDb Movies & TV _8	IMDb Movies & TV _8_0	train	does this app require a login?	0	0	0	0	0	0	0
../../Dataset/Train/com.imdb.mobile	IMDb Movies & TV _8	IMDb Movies & TV _8_1	train	does this app track my viewing habits?	1	0	0	0	0	0	0
../../Dataset/Train/com.imdb.mobile	IMDb Movies & TV _8	IMDb Movies & TV _8_2	train	does the app share my information with others?	0	1	0	0	0	0	0
../../Dataset/Train/com.imdb.mobile	IMDb Movies & TV _8	IMDb Movies & TV _8_3	train	what permissions does this app require?	0	0	0	0	0	0	0
../../Dataset/Train/com.imdb.mobile	IMDb Movies & TV _8	IMDb Movies & TV _8_4	train	does the app collect my demographics?	1	0	0	0	0	0	0
../../Dataset/Train/com.imdb.mobile	IMDb Movies & TV _8	IMDb Movies & TV _8_5	train	does the app save my search history?	1	0	0	0	0	0	0
../../Dataset/Train/com.imdb.mobile	IMDb Movies & TV _8	IMDb Movies & TV _8_6	train	can the app see my location?	1	0	0	0	0	0	0
../../Dataset/Train/com.imdb.mobile	IMDb Movies & TV _8	IMDb Movies & TV _8_7	train	can the app see my interest searches?	1	0	0	0	0	0	0
../../Dataset/Train/com.imdb.mobile	IMDb Movies & TV _8	IMDb Movies & TV _8_8	train	can the app see my contacts?	1	0	0	0	0	0	0
../../Dataset/Train/com.imdb.mobile	IMDb Movies & TV _8	IMDb Movies & TV _8_9	train	can the app see where i've ordered tickets?	1	0	0	0	0	0	0
../../Dataset/Train/com.imdb.mobile	IMDb Movies & TV _8	IMDb Movies & TV _8_10	train	will it be able to access my location?	1	0	0	0	0	0	0
../../Dataset/Train/com.imdb.mobile	IMDb Movies & TV _8	IMDb Movies & TV _8_11	train	how long will my movie history be kept?	0	0	0	1	0	0	0
../../Dataset/Train/com.imdb.mobile	IMDb Movies & TV _8	IMDb Movies & TV _8_12	train	can other members see my real name?	0	1	0	0	0	0	0
../../Dataset/Train/com.imdb.mobile	IMDb Movies & TV _8	IMDb Movies & TV _8_13	train	will my password be stored securely?	0	0	1	0	0	0	0
../../Dataset/Train/com.imdb.mobile	IMDb Movies & TV _8	IMDb Movies & TV _8_14	train	can i easily delete my personally identifying information?	0	0	0	0	1	0	0
../../Dataset/Train/com.imdb.mobile	IMDb Movies & TV _8	IMDb Movies & TV _8_15	train	will my information be shared with anyone outside of the app?	0	1	0	0	0	0	0
../../Dataset/Train/com.imdb.mobile	IMDb Movies & TV _8	IMDb Movies & TV _8_16	train	does my information get sold?	0	1	0	0	0	0	0
../../Dataset/Train/com.imdb.mobile	IMDb Movies & TV _8	IMDb Movies & TV _8_17	train	how can you guarantee my location information is secure?	0	0	1	0	0	0	0
../../Dataset/Train/com.imdb.mobile	IMDb Movies & TV _8	IMDb Movies & TV _8_18	train	if i buy tickets from my phone, how is my payment information stored?	1	0	0	0	0	0	0
../../Dataset/Train/com.imdb.mobile	IMDb Movies & TV _8	IMDb Movies & TV _8_19	train	will anyone be able to access my watchlist?	0	1	0	0	0	0	0
../../Dataset/Train/com.imdb.mobile	IMDb Movies & TV _8	IMDb Movies & TV _8_20	train	does the app save my location when i search for a theater near me?	1	0	0	0	0	0	0
../../Dataset/Train/com.imdb.mobile	IMDb Movies & TV _8	IMDb Movies & TV _8_21	train	does the app save my payment data when i buy movie tickets?	1	0	0	0	0	0	0
../../Dataset/Train/com.imdb.mobile	IMDb Movies & TV _8	IMDb Movies & TV _8_22	train	is information shared with any third parties?	0	1	0	0	0	0	0
../../Dataset/Train/com.imdb.mobile	IMDb Movies & TV _8	IMDb Movies & TV _8_23	train	does the app use targeted ads for movies?	0	1	0	0	0	0	0
../../Dataset/Train/com.imdb.mobile	IMDb Movies & TV _8	IMDb Movies & TV _8_24	train	can the app always access my location?	1	0	0	0	0	0	0
../../Dataset/Train/com.imdb.mobile	IMDb Movies & TV _8	IMDb Movies & TV _8_25	train	do you track my browsing history	1	0	0	0	0	0	0
../../Dataset/Train/com.imdb.mobile	IMDb Movies & TV _8	IMDb Movies & TV _8_26	train	do you keep and upload my browsing history to your database	1	0	0	0	0	0	0
../../Dataset/Train/com.imdb.mobile	IMDb Movies & TV _8	IMDb Movies & TV _8_27	train	do you use my date to modify the app	0	0	0	0	0	0	0
../../Dataset/Train/com.imdb.mobile	IMDb Movies & TV _8	IMDb Movies & TV _8_28	train	do you sell my data	0	1	0	0	0	0	0
../../Dataset/Train/com.imdb.mobile	IMDb Movies & TV _8	IMDb Movies & TV _8_29	train	is there any incognito mode	0	0	0	0	0	0	0
../../Dataset/Train/com.imdb.mobile	IMDb Movies & TV _8	IMDb Movies & TV _8_30	train	does the application keeps a record of my location and theater preferences?	1	0	0	0	0	0	0
../../Dataset/Train/com.imdb.mobile	IMDb Movies & TV _8	IMDb Movies & TV _8_31	train	does the application have any ads that is personalized to me?	0	1	0	0	0	0	0
../../Dataset/Train/com.imdb.mobile	IMDb Movies & TV _8	IMDb Movies & TV _8_32	train	how does the application ensure my payment method security?	0	0	1	0	0	0	0
../../Dataset/Train/com.imdb.mobile	IMDb Movies & TV _8	IMDb Movies & TV _8_33	train	does the application sell my favorite list to advertisers?	0	1	0	0	0	0	0
../../Dataset/Train/com.imdb.mobile	IMDb Movies & TV _8	IMDb Movies & TV _8_34	train	are recommendations influenced by advertisers?	0	1	0	0	0	0	0
../../Dataset/Train/com.imdb.mobile	IMDb Movies & TV _8	IMDb Movies & TV _8_35	train	can you clear your app history?	0	0	0	0	1	0	0
../../Dataset/Train/com.imdb.mobile	IMDb Movies & TV _8	IMDb Movies & TV _8_36	train	is the app history shared with anyone?	0	1	0	0	0	0	0
../../Dataset/Train/com.imdb.mobile	IMDb Movies & TV _8	IMDb Movies & TV _8_37	train	can people see what celebs i have looked up?	1	0	0	0	0	0	0
../../Dataset/Train/com.imdb.mobile	IMDb Movies & TV _8	IMDb Movies & TV _8_38	train	can i use it without an account?	0	0	0	0	0	0	0
../../Dataset/Train/com.imdb.mobile	IMDb Movies & TV _8	IMDb Movies & TV _8_39	train	is my watchlist shared publicly?	0	0	0	0	0	0	0
../../Dataset/Train/com.imdb.mobile	IMDb Movies & TV _8	IMDb Movies & TV _8_40	train	if i want to save items to a list, do i have to be signed in?	0	0	0	0	0	0	0
../../Dataset/Train/com.imdb.mobile	IMDb Movies & TV _8	IMDb Movies & TV _8_41	train	do i have to create an imdb specific login to use the app or save items?	0	0	0	0	0	0	0
../../Dataset/Train/com.imdb.mobile	IMDb Movies & TV _8	IMDb Movies & TV _8_42	train	what privacy permissions are requested upon launching the app for the first time?	0	0	0	0	1	0	0
../../Dataset/Train/com.imdb.mobile	IMDb Movies & TV _8	IMDb Movies & TV _8_43	train	will my data be sold or available to be used by third party entities?	0	1	0	0	0	0	0
../../Dataset/Train/com.imdb.mobile	IMDb Movies & TV _8	IMDb Movies & TV _8_44	train	will my location be tracked and collected continuously?	1	0	0	0	0	0	0
../../Dataset/Train/com.imdb.mobile	IMDb Movies & TV _8	IMDb Movies & TV _8_45	train	does the app remember my amazon sign in info?	0	0	0	0	0	0	0
../../Dataset/Train/com.imdb.mobile	IMDb Movies & TV _8	IMDb Movies & TV _8_46	train	does this app keep a record of my locations?	1	0	0	0	0	0	0
../../Dataset/Train/com.imdb.mobile	IMDb Movies & TV _8	IMDb Movies & TV _8_47	train	is any payment information required for any of the features of this app?	0	0	0	0	0	0	0
../../Dataset/Train/com.imdb.mobile	IMDb Movies & TV _8	IMDb Movies & TV _8_48	train	are my browsing habits in the app tracked publicly?	1	0	0	0	0	0	0
../../Dataset/Train/com.imdb.mobile	IMDb Movies & TV _8	IMDb Movies & TV _8_49	train	how secure do you think this app is, along with any info i may give it access to?	0	0	1	0	0	0	0
../../Dataset/Train/com.intuit.quickbooks	QuickBooks Accounting: Invoicing & Expenses _9	QuickBooks Accounting: Invoicing & Expenses _9_0	train	are my invoices safe.	0	0	0	0	0	0	0
../../Dataset/Train/com.intuit.quickbooks	QuickBooks Accounting: Invoicing & Expenses _9	QuickBooks Accounting: Invoicing & Expenses _9_1	train	who else can see my data.	0	0	0	0	0	0	0
../../Dataset/Train/com.intuit.quickbooks	QuickBooks Accounting: Invoicing & Expenses _9	QuickBooks Accounting: Invoicing & Expenses _9_2	train	how is my data secured.	0	0	0	0	0	0	0
../../Dataset/Train/com.intuit.quickbooks	QuickBooks Accounting: Invoicing & Expenses _9	QuickBooks Accounting: Invoicing & Expenses _9_3	train	what permissions does the app use?	1	0	0	0	0	0	0
../../Dataset/Train/com.intuit.quickbooks	QuickBooks Accounting: Invoicing & Expenses _9	QuickBooks Accounting: Invoicing & Expenses _9_4	train	is my data sold to third parties?	0	1	0	0	0	0	0
../../Dataset/Train/com.intuit.quickbooks	QuickBooks Accounting: Invoicing & Expenses _9	QuickBooks Accounting: Invoicing & Expenses _9_5	train	will my financial details be sold to facebook?	0	1	0	0	0	0	0
../../Dataset/Train/com.intuit.quickbooks	QuickBooks Accounting: Invoicing & Expenses _9	QuickBooks Accounting: Invoicing & Expenses _9_6	train	do you have two-step verification?	0	0	0	0	0	0	0
../../Dataset/Train/com.intuit.quickbooks	QuickBooks Accounting: Invoicing & Expenses _9	QuickBooks Accounting: Invoicing & Expenses _9_7	train	will my location be monitored by facebook?	0	1	0	0	0	0	0
../../Dataset/Train/com.intuit.quickbooks	QuickBooks Accounting: Invoicing & Expenses _9	QuickBooks Accounting: Invoicing & Expenses _9_8	train	will my credit card information be forever saved into the system?	0	0	0	1	0	0	0
../../Dataset/Train/com.intuit.quickbooks	QuickBooks Accounting: Invoicing & Expenses _9	QuickBooks Accounting: Invoicing & Expenses _9_9	train	will my company sheets be sold to facebook?	0	1	0	0	0	0	0
../../Dataset/Train/com.intuit.quickbooks	QuickBooks Accounting: Invoicing & Expenses _9	QuickBooks Accounting: Invoicing & Expenses _9_10	train	who can access my invoices?	0	0	0	0	0	0	0
../../Dataset/Train/com.intuit.quickbooks	QuickBooks Accounting: Invoicing & Expenses _9	QuickBooks Accounting: Invoicing & Expenses _9_11	train	who can see my current receivables?	0	0	0	0	0	0	0
../../Dataset/Train/com.intuit.quickbooks	QuickBooks Accounting: Invoicing & Expenses _9	QuickBooks Accounting: Invoicing & Expenses _9_12	train	who can see what i pay?	0	0	0	0	0	0	0
../../Dataset/Train/com.intuit.quickbooks	QuickBooks Accounting: Invoicing & Expenses _9	QuickBooks Accounting: Invoicing & Expenses _9_13	train	can someone mark an invoice paid without my approval?	0	0	0	0	0	0	0
../../Dataset/Train/com.intuit.quickbooks	QuickBooks Accounting: Invoicing & Expenses _9	QuickBooks Accounting: Invoicing & Expenses _9_14	train	what methods do you have to protect my account?	0	0	0	0	0	0	0
../../Dataset/Train/com.intuit.quickbooks	QuickBooks Accounting: Invoicing & Expenses _9	QuickBooks Accounting: Invoicing & Expenses _9_15	train	how is my information kept safe?	0	0	0	0	0	0	0
../../Dataset/Train/com.intuit.quickbooks	QuickBooks Accounting: Invoicing & Expenses _9	QuickBooks Accounting: Invoicing & Expenses _9_16	train	how long will you keep my information?	0	0	0	1	0	0	0
../../Dataset/Train/com.intuit.quickbooks	QuickBooks Accounting: Invoicing & Expenses _9	QuickBooks Accounting: Invoicing & Expenses _9_17	train	is my information shared with third parties?	0	0	0	0	0	0	0
../../Dataset/Train/com.intuit.quickbooks	QuickBooks Accounting: Invoicing & Expenses _9	QuickBooks Accounting: Invoicing & Expenses _9_18	train	what recourse do i have if my information is stolen?	0	0	0	0	0	0	0
../../Dataset/Train/com.intuit.quickbooks	QuickBooks Accounting: Invoicing & Expenses _9	QuickBooks Accounting: Invoicing & Expenses _9_19	train	have you had any data breaches in the last couple of years?	0	0	0	0	0	0	0
../../Dataset/Train/com.intuit.quickbooks	QuickBooks Accounting: Invoicing & Expenses _9	QuickBooks Accounting: Invoicing & Expenses _9_20	train	how much of my private information are they storing?	1	0	0	0	0	0	0
../../Dataset/Train/com.intuit.quickbooks	QuickBooks Accounting: Invoicing & Expenses _9	QuickBooks Accounting: Invoicing & Expenses _9_21	train	how long do they keep my information for?	0	0	0	1	0	0	0
../../Dataset/Train/com.intuit.quickbooks	QuickBooks Accounting: Invoicing & Expenses _9	QuickBooks Accounting: Invoicing & Expenses _9_22	train	who is the accounting information going to?	0	1	0	0	0	0	0
../../Dataset/Train/com.intuit.quickbooks	QuickBooks Accounting: Invoicing & Expenses _9	QuickBooks Accounting: Invoicing & Expenses _9_23	train	does an actual person see this information?	0	0	0	0	0	0	0
../../Dataset/Train/com.intuit.quickbooks	QuickBooks Accounting: Invoicing & Expenses _9	QuickBooks Accounting: Invoicing & Expenses _9_24	train	will this be used against me in any way?	0	0	0	0	0	0	0
../../Dataset/Train/com.intuit.quickbooks	QuickBooks Accounting: Invoicing & Expenses _9	QuickBooks Accounting: Invoicing & Expenses _9_25	train	is my dashboard activity shared with anyone?	0	0	0	0	0	0	0
../../Dataset/Train/com.intuit.quickbooks	QuickBooks Accounting: Invoicing & Expenses _9	QuickBooks Accounting: Invoicing & Expenses _9_26	train	can i use it without it calling home?	0	0	0	0	0	0	0
../../Dataset/Train/com.intuit.quickbooks	QuickBooks Accounting: Invoicing & Expenses _9	QuickBooks Accounting: Invoicing & Expenses _9_27	train	does it have advertisements?	1	0	0	0	0	0	0
../../Dataset/Train/com.intuit.quickbooks	QuickBooks Accounting: Invoicing & Expenses _9	QuickBooks Accounting: Invoicing & Expenses _9_28	train	does it require any special permissions?	1	0	0	0	0	0	0
../../Dataset/Train/com.intuit.quickbooks	QuickBooks Accounting: Invoicing & Expenses _9	QuickBooks Accounting: Invoicing & Expenses _9_29	train	does it use background data?	1	0	0	0	0	0	0
../../Dataset/Train/com.intuit.quickbooks	QuickBooks Accounting: Invoicing & Expenses _9	QuickBooks Accounting: Invoicing & Expenses _9_30	train	who will be able to see my invoices?	0	0	0	0	0	0	0
../../Dataset/Train/com.intuit.quickbooks	QuickBooks Accounting: Invoicing & Expenses _9	QuickBooks Accounting: Invoicing & Expenses _9_31	train	are the invoices encrypted?	0	0	1	0	0	0	0
../../Dataset/Train/com.intuit.quickbooks	QuickBooks Accounting: Invoicing & Expenses _9	QuickBooks Accounting: Invoicing & Expenses _9_32	train	can i delete my data?	0	0	0	0	1	0	0
../../Dataset/Train/com.intuit.quickbooks	QuickBooks Accounting: Invoicing & Expenses _9	QuickBooks Accounting: Invoicing & Expenses _9_33	train	can i set up 2fa?	0	0	0	0	0	0	0
../../Dataset/Train/com.intuit.quickbooks	QuickBooks Accounting: Invoicing & Expenses _9	QuickBooks Accounting: Invoicing & Expenses _9_34	train	how long do you keep my history for?	0	0	0	1	0	0	0
../../Dataset/Train/com.intuit.quickbooks	QuickBooks Accounting: Invoicing & Expenses _9	QuickBooks Accounting: Invoicing & Expenses _9_35	train	are any of my finances in the app transmitted to the application owner?	0	0	0	0	0	0	0
../../Dataset/Train/com.intuit.quickbooks	QuickBooks Accounting: Invoicing & Expenses _9	QuickBooks Accounting: Invoicing & Expenses _9_36	train	are financial reports generated inside the app or in a server and then sent to the application?	1	0	0	0	0	0	0
../../Dataset/Train/com.intuit.quickbooks	QuickBooks Accounting: Invoicing & Expenses _9	QuickBooks Accounting: Invoicing & Expenses _9_37	train	is the application connected to the internet at all?	0	0	0	0	0	0	0
../../Dataset/Train/com.intuit.quickbooks	QuickBooks Accounting: Invoicing & Expenses _9	QuickBooks Accounting: Invoicing & Expenses _9_38	train	does the company sell my financial status to banking corporations?	0	1	0	0	0	0	0
../../Dataset/Train/com.intuit.quickbooks	QuickBooks Accounting: Invoicing & Expenses _9	QuickBooks Accounting: Invoicing & Expenses _9_39	train	are my financial records secure when synced to the app?	0	0	0	0	0	0	0
../../Dataset/Train/com.intuit.quickbooks	QuickBooks Accounting: Invoicing & Expenses _9	QuickBooks Accounting: Invoicing & Expenses _9_40	train	will my data be saved permanently?	0	0	0	1	0	0	0
../../Dataset/Train/com.intuit.quickbooks	QuickBooks Accounting: Invoicing & Expenses _9	QuickBooks Accounting: Invoicing & Expenses _9_41	train	is my data stored on third party servers that may be vulnerable to data breaches?	0	0	0	0	0	0	0
../../Dataset/Train/com.intuit.quickbooks	QuickBooks Accounting: Invoicing & Expenses _9	QuickBooks Accounting: Invoicing & Expenses _9_42	train	what privacy permissions are requested upon launching the app for the first time?	1	0	0	0	0	0	0
../../Dataset/Train/com.intuit.quickbooks	QuickBooks Accounting: Invoicing & Expenses _9	QuickBooks Accounting: Invoicing & Expenses _9_43	train	can i enable/disable data tracking by the application?	1	0	0	0	0	0	0
../../Dataset/Train/com.intuit.quickbooks	QuickBooks Accounting: Invoicing & Expenses _9	QuickBooks Accounting: Invoicing & Expenses _9_44	train	what sort of analytics are integrated in the app?	1	0	0	0	0	0	0
../../Dataset/Train/com.intuit.quickbooks	QuickBooks Accounting: Invoicing & Expenses _9	QuickBooks Accounting: Invoicing & Expenses _9_45	train	is the information recorded	1	0	0	0	0	0	0
../../Dataset/Train/com.intuit.quickbooks	QuickBooks Accounting: Invoicing & Expenses _9	QuickBooks Accounting: Invoicing & Expenses _9_46	train	how long is information saved	0	0	0	1	0	0	0
../../Dataset/Train/com.intuit.quickbooks	QuickBooks Accounting: Invoicing & Expenses _9	QuickBooks Accounting: Invoicing & Expenses _9_47	train	hwere is it saved	0	0	0	1	0	0	0
../../Dataset/Train/com.intuit.quickbooks	QuickBooks Accounting: Invoicing & Expenses _9	QuickBooks Accounting: Invoicing & Expenses _9_48	train	is the information encrypted	0	0	1	0	0	0	0
../../Dataset/Train/com.intuit.quickbooks	QuickBooks Accounting: Invoicing & Expenses _9	QuickBooks Accounting: Invoicing & Expenses _9_49	train	will it be shared	0	0	0	0	0	0	0
../../Dataset/Train/com.maxmpz.audioplayer	Poweramp Music Player (Trial) _10	Poweramp Music Player (Trial) _10_0	train	does it collect cookies?	1	0	0	0	0	0	0
../../Dataset/Train/com.maxmpz.audioplayer	Poweramp Music Player (Trial) _10	Poweramp Music Player (Trial) _10_1	train	does it anonymize personal data?	0	0	1	0	0	0	0
../../Dataset/Train/com.maxmpz.audioplayer	Poweramp Music Player (Trial) _10	Poweramp Music Player (Trial) _10_2	train	is my data excrypted?	0	0	1	0	0	0	0
../../Dataset/Train/com.maxmpz.audioplayer	Poweramp Music Player (Trial) _10	Poweramp Music Player (Trial) _10_3	train	is my data sold to third parties?	1	1	0	0	0	0	0
../../Dataset/Train/com.maxmpz.audioplayer	Poweramp Music Player (Trial) _10	Poweramp Music Player (Trial) _10_4	train	what types of personal information does it collect and keep, and for how long?	0	0	0	1	0	0	0
../../Dataset/Train/com.maxmpz.audioplayer	Poweramp Music Player (Trial) _10	Poweramp Music Player (Trial) _10_5	train	do my sound settings get shared with third parties?	0	1	0	0	0	0	0
../../Dataset/Train/com.maxmpz.audioplayer	Poweramp Music Player (Trial) _10	Poweramp Music Player (Trial) _10_6	train	does this app require special permissions?	1	0	0	0	0	0	0
../../Dataset/Train/com.maxmpz.audioplayer	Poweramp Music Player (Trial) _10	Poweramp Music Player (Trial) _10_7	train	are my music choices public?	0	1	0	0	0	0	0
../../Dataset/Train/com.maxmpz.audioplayer	Poweramp Music Player (Trial) _10	Poweramp Music Player (Trial) _10_8	train	do i need an account to use it?	1	0	0	0	0	1	0
../../Dataset/Train/com.maxmpz.audioplayer	Poweramp Music Player (Trial) _10	Poweramp Music Player (Trial) _10_9	train	can i use it without an internet connection.	1	0	0	0	0	0	1
../../Dataset/Train/com.maxmpz.audioplayer	Poweramp Music Player (Trial) _10	Poweramp Music Player (Trial) _10_10	train	is it able to access my location frequently?	1	0	0	0	0	0	0
../../Dataset/Train/com.maxmpz.audioplayer	Poweramp Music Player (Trial) _10	Poweramp Music Player (Trial) _10_11	train	will my real name be required?	1	0	0	0	0	1	0
../../Dataset/Train/com.maxmpz.audioplayer	Poweramp Music Player (Trial) _10	Poweramp Music Player (Trial) _10_12	train	does it know if i have a lot of other apps installed?	0	0	0	0	0	0	0
../../Dataset/Train/com.maxmpz.audioplayer	Poweramp Music Player (Trial) _10	Poweramp Music Player (Trial) _10_13	train	how will my password be stored?	0	0	0	0	0	0	0
../../Dataset/Train/com.maxmpz.audioplayer	Poweramp Music Player (Trial) _10	Poweramp Music Player (Trial) _10_14	train	does it keep track of my previous selections?	1	0	0	0	0	0	0
../../Dataset/Train/com.maxmpz.audioplayer	Poweramp Music Player (Trial) _10	Poweramp Music Player (Trial) _10_15	train	will i be required to provide credit card/payment info upon opening the app for the first time?	1	0	0	0	0	0	0
../../Dataset/Train/com.maxmpz.audioplayer	Poweramp Music Player (Trial) _10	Poweramp Music Player (Trial) _10_16	train	how long will my payment information be retained if i decide not to continue with the trial?	1	0	0	1	0	0	0
../../Dataset/Train/com.maxmpz.audioplayer	Poweramp Music Player (Trial) _10	Poweramp Music Player (Trial) _10_17	train	what kind of analytics do you employ?	1	0	0	0	0	0	0
../../Dataset/Train/com.maxmpz.audioplayer	Poweramp Music Player (Trial) _10	Poweramp Music Player (Trial) _10_18	train	will my personal audio files be stored on secure server?	0	0	1	0	0	0	0
../../Dataset/Train/com.maxmpz.audioplayer	Poweramp Music Player (Trial) _10	Poweramp Music Player (Trial) _10_19	train	will any sort of social media based log-in be required?	0	0	0	0	0	0	0
../../Dataset/Train/com.maxmpz.audioplayer	Poweramp Music Player (Trial) _10	Poweramp Music Player (Trial) _10_20	train	what other features of my phone will the app access	1	0	0	0	0	0	0
../../Dataset/Train/com.maxmpz.audioplayer	Poweramp Music Player (Trial) _10	Poweramp Music Player (Trial) _10_21	train	what data will be collected on my use of my phone and app	1	0	0	0	0	0	0
../../Dataset/Train/com.maxmpz.audioplayer	Poweramp Music Player (Trial) _10	Poweramp Music Player (Trial) _10_22	train	where and how will that data be stored	0	0	0	0	0	0	0
../../Dataset/Train/com.maxmpz.audioplayer	Poweramp Music Player (Trial) _10	Poweramp Music Player (Trial) _10_23	train	how will that data be used, will it be sold	1	1	0	0	0	0	0
../../Dataset/Train/com.maxmpz.audioplayer	Poweramp Music Player (Trial) _10	Poweramp Music Player (Trial) _10_24	train	can i delete my data from your systems and records	0	0	0	1	0	0	0
../../Dataset/Train/com.maxmpz.audioplayer	Poweramp Music Player (Trial) _10	Poweramp Music Player (Trial) _10_25	train	do you need access to my microphone?	1	0	0	0	0	0	0
../../Dataset/Train/com.maxmpz.audioplayer	Poweramp Music Player (Trial) _10	Poweramp Music Player (Trial) _10_26	train	do you record anything via my mic?	1	0	0	0	0	0	0
../../Dataset/Train/com.maxmpz.audioplayer	Poweramp Music Player (Trial) _10	Poweramp Music Player (Trial) _10_27	train	do you need access to my photos or videos?	0	0	0	0	0	0	0
../../Dataset/Train/com.maxmpz.audioplayer	Poweramp Music Player (Trial) _10	Poweramp Music Player (Trial) _10_28	train	is any of my info sold to 3rd parties?	1	1	0	0	0	0	0
../../Dataset/Train/com.maxmpz.audioplayer	Poweramp Music Player (Trial) _10	Poweramp Music Player (Trial) _10_29	train	is anything i do in the app saved forever?	1	1	0	0	0	0	0
../../Dataset/Train/com.maxmpz.audioplayer	Poweramp Music Player (Trial) _10	Poweramp Music Player (Trial) _10_30	train	what permissions does the app require?	1	0	0	0	0	0	0
../../Dataset/Train/com.maxmpz.audioplayer	Poweramp Music Player (Trial) _10	Poweramp Music Player (Trial) _10_31	train	what data can the app see on my device?	1	0	0	0	0	0	0
../../Dataset/Train/com.maxmpz.audioplayer	Poweramp Music Player (Trial) _10	Poweramp Music Player (Trial) _10_32	train	"does this app \call home\"" or transmit data anywhere?"""	0	1	0	0	0	0	0
../../Dataset/Train/com.maxmpz.audioplayer	Poweramp Music Player (Trial) _10	Poweramp Music Player (Trial) _10_33	train	does this app ask for any personal information?	1	0	0	0	0	0	0
../../Dataset/Train/com.maxmpz.audioplayer	Poweramp Music Player (Trial) _10	Poweramp Music Player (Trial) _10_34	train	does this app read my browser history to target ads at me?	1	0	0	0	0	0	0
../../Dataset/Train/com.maxmpz.audioplayer	Poweramp Music Player (Trial) _10	Poweramp Music Player (Trial) _10_35	train	does it turn on my camera without my knowledge?	1	0	0	0	0	0	0
