Folder	DocID	QueryID	Split	Query	first	third	datasecurity	dataretention	user_access	user_choice	other
../../Dataset/Train/com.cake.browser	Cake Web Browser _1	Cake Web Browser _1_0	train	do you keep the data of mine and upload to your company	0	0	0	1	0	0	0
../../Dataset/Train/com.cake.browser	Cake Web Browser _1	Cake Web Browser _1_1	train	do i need to pay	0	0	0	0	0	0	0
../../Dataset/Train/com.cake.browser	Cake Web Browser _1	Cake Web Browser _1_2	train	do you know and use my location	1	0	0	0	0	0	0
../../Dataset/Train/com.cake.browser	Cake Web Browser _1	Cake Web Browser _1_3	train	do you sell my data	0	1	0	0	0	0	0
../../Dataset/Train/com.cake.browser	Cake Web Browser _1	Cake Web Browser _1_4	train	is there any incognito mode	0	0	0	0	0	0	0
../../Dataset/Train/com.cake.browser	Cake Web Browser _1	Cake Web Browser _1_5	train	is my information shared with anyone?	0	1	0	0	0	0	0
../../Dataset/Train/com.cake.browser	Cake Web Browser _1	Cake Web Browser _1_6	train	is my information ever sold?	0	1	0	0	0	0	0
../../Dataset/Train/com.cake.browser	Cake Web Browser _1	Cake Web Browser _1_7	train	are their paid advertisers for this service?	0	0	0	0	0	0	0
../../Dataset/Train/com.cake.browser	Cake Web Browser _1	Cake Web Browser _1_8	train	how long is my information stored?	0	0	0	1	0	0	0
../../Dataset/Train/com.cake.browser	Cake Web Browser _1	Cake Web Browser _1_9	train	what information do you collect?	1	0	0	0	0	0	0
../../Dataset/Train/com.cake.browser	Cake Web Browser _1	Cake Web Browser _1_10	train	does it sell my private information?	0	1	0	0	0	0	0
../../Dataset/Train/com.cake.browser	Cake Web Browser _1	Cake Web Browser _1_11	train	does it save my ip?	0	0	0	0	0	0	0
../../Dataset/Train/com.cake.browser	Cake Web Browser _1	Cake Web Browser _1_12	train	do i have to accept cookies from it?	1	1	0	0	0	0	0
../../Dataset/Train/com.cake.browser	Cake Web Browser _1	Cake Web Browser _1_13	train	does it use my browsing history?	1	0	0	0	0	0	0
../../Dataset/Train/com.cake.browser	Cake Web Browser _1	Cake Web Browser _1_14	train	what kind of data does it save from me?	1	0	0	0	0	0	0
../../Dataset/Train/com.cake.browser	Cake Web Browser _1	Cake Web Browser _1_15	train	does it give my search terms to all the services?	0	1	0	0	0	0	0
../../Dataset/Train/com.cake.browser	Cake Web Browser _1	Cake Web Browser _1_16	train	can i make it ignore specific search engines i distrust?	0	0	0	0	0	0	0
../../Dataset/Train/com.cake.browser	Cake Web Browser _1	Cake Web Browser _1_17	train	does it sell my information?	0	1	0	0	0	0	0
../../Dataset/Train/com.cake.browser	Cake Web Browser _1	Cake Web Browser _1_18	train	does it access any of my social profiles/contacts/etc?	1	0	0	0	0	0	0
../../Dataset/Train/com.cake.browser	Cake Web Browser _1	Cake Web Browser _1_19	train	can i delete my search history?	0	0	0	0	1	0	0
../../Dataset/Train/com.cake.browser	Cake Web Browser _1	Cake Web Browser _1_20	train	what information about me is being stored?	1	0	0	0	0	0	0
../../Dataset/Train/com.cake.browser	Cake Web Browser _1	Cake Web Browser _1_21	train	if they are, why is all my contacts information needed?	1	0	0	0	0	0	0
../../Dataset/Train/com.cake.browser	Cake Web Browser _1	Cake Web Browser _1_22	train	are swiping/hand gestures being recorded?	1	0	0	0	0	0	0
../../Dataset/Train/com.cake.browser	Cake Web Browser _1	Cake Web Browser _1_23	train	is what i look at being recorded?	1	0	0	0	0	0	0
../../Dataset/Train/com.cake.browser	Cake Web Browser _1	Cake Web Browser _1_24	train	where and what is this secured connection?	0	0	0	0	0	0	0
../../Dataset/Train/com.cake.browser	Cake Web Browser _1	Cake Web Browser _1_25	train	is all my personal information really private?	1	0	0	0	0	0	0
../../Dataset/Train/com.cake.browser	Cake Web Browser _1	Cake Web Browser _1_26	train	does cake sell my personal information?	0	1	0	0	0	0	0
../../Dataset/Train/com.cake.browser	Cake Web Browser _1	Cake Web Browser _1_27	train	how does cake protect my personal information?	0	0	1	0	0	0	0
../../Dataset/Train/com.cake.browser	Cake Web Browser _1	Cake Web Browser _1_28	train	how does cake's privacy mode work?	1	0	0	0	0	0	0
../../Dataset/Train/com.cake.browser	Cake Web Browser _1	Cake Web Browser _1_29	train	does cake keep records of what i search for?	1	0	0	0	0	0	0
../../Dataset/Train/com.cake.browser	Cake Web Browser _1	Cake Web Browser _1_30	train	does the app record what news i read?	1	0	0	0	0	0	0
../../Dataset/Train/com.cake.browser	Cake Web Browser _1	Cake Web Browser _1_31	train	does the app save my group searches?	1	0	0	0	0	0	0
../../Dataset/Train/com.cake.browser	Cake Web Browser _1	Cake Web Browser _1_32	train	does it share what search providers i have enabled?	0	1	0	0	0	0	0
../../Dataset/Train/com.cake.browser	Cake Web Browser _1	Cake Web Browser _1_33	train	does it require an account to work?	0	0	0	0	0	0	0
../../Dataset/Train/com.cake.browser	Cake Web Browser _1	Cake Web Browser _1_34	train	does it run in the background?	0	0	0	0	0	0	0
../../Dataset/Train/com.cake.browser	Cake Web Browser _1	Cake Web Browser _1_35	train	will it be able to view my location?	1	0	0	0	0	0	0
../../Dataset/Train/com.cake.browser	Cake Web Browser _1	Cake Web Browser _1_36	train	how long will my browser history be kept?	0	0	0	1	1	0	0
../../Dataset/Train/com.cake.browser	Cake Web Browser _1	Cake Web Browser _1_37	train	can it view my real name?	1	0	0	0	0	0	0
../../Dataset/Train/com.cake.browser	Cake Web Browser _1	Cake Web Browser _1_38	train	will my passwords be stored securely?	1	0	0	0	0	0	0
../../Dataset/Train/com.cake.browser	Cake Web Browser _1	Cake Web Browser _1_39	train	is it easy to delete my personally identifying information?	0	0	0	0	1	0	0
../../Dataset/Train/com.cake.browser	Cake Web Browser _1	Cake Web Browser _1_40	train	is it tracking my location? is it selling what i am looking up?	1	1	0	0	0	0	0
../../Dataset/Train/com.cake.browser	Cake Web Browser _1	Cake Web Browser _1_41	train	is it watching what i am searching? are businesses getting my personal information?	1	1	0	0	0	0	0
../../Dataset/Train/com.cake.browser	Cake Web Browser _1	Cake Web Browser _1_42	train	does it keep a record of what i am searching? what is the privacy policy?	1	0	0	0	0	0	0
../../Dataset/Train/com.cake.browser	Cake Web Browser _1	Cake Web Browser _1_43	train	does it report to anyone what i am searching	1	0	0	0	0	0	0
../../Dataset/Train/com.cake.browser	Cake Web Browser _1	Cake Web Browser _1_44	train	is it giving third parties my information? is it selling my information?	0	1	0	0	0	0	0
../../Dataset/Train/com.cake.browser	Cake Web Browser _1	Cake Web Browser _1_45	train	is any of my data sent to third party entities?	0	1	0	0	0	0	0
../../Dataset/Train/com.cake.browser	Cake Web Browser _1	Cake Web Browser _1_46	train	can i selectively block scripts on pages that i feel are invading my privacy?	0	0	0	0	0	1	0
../../Dataset/Train/com.cake.browser	Cake Web Browser _1	Cake Web Browser _1_47	train	does the browser require any sort of logging-in?	0	0	0	0	0	0	0
../../Dataset/Train/com.cake.browser	Cake Web Browser _1	Cake Web Browser _1_48	train	can i delete select cookies?	0	0	0	0	0	1	0
../../Dataset/Train/com.cake.browser	Cake Web Browser _1	Cake Web Browser _1_49	train	does the app continuously track my location?	1	0	0	0	0	0	0
../../Dataset/Train/com.cleanmaster.mguard	Clean Master_2	Clean Master_2_0	train	will you use my data for advertising?	0	1	0	0	0	0	0
../../Dataset/Train/com.cleanmaster.mguard	Clean Master_2	Clean Master_2_1	train	will my information be shared with a third party?	0	1	0	0	0	0	0
../../Dataset/Train/com.cleanmaster.mguard	Clean Master_2	Clean Master_2_2	train	is there a fee i can pay to keep my information secure?	0	0	0	0	0	0	0
../../Dataset/Train/com.cleanmaster.mguard	Clean Master_2	Clean Master_2_3	train	is there a firewall that protects the organization?	0	0	1	0	0	0	0
../../Dataset/Train/com.cleanmaster.mguard	Clean Master_2	Clean Master_2_4	train	are their tiered options for security?	0	0	0	0	0	1	0
../../Dataset/Train/com.cleanmaster.mguard	Clean Master_2	Clean Master_2_5	train	does the clean master app read any of my files?	1	0	0	0	0	0	0
../../Dataset/Train/com.cleanmaster.mguard	Clean Master_2	Clean Master_2_6	train	can the application hide my photos without access privilege to my photos folder?	1	0	0	0	0	0	0
../../Dataset/Train/com.cleanmaster.mguard	Clean Master_2	Clean Master_2_7	train	is the app able to detect my location based on the wifi?	1	0	0	0	0	0	0
../../Dataset/Train/com.cleanmaster.mguard	Clean Master_2	Clean Master_2_8	train	how does the application know what application i have?	1	0	0	0	0	0	0
../../Dataset/Train/com.cleanmaster.mguard	Clean Master_2	Clean Master_2_9	train	how does the application determine what files are the wrong files to delete?	0	0	0	0	0	0	0
../../Dataset/Train/com.cleanmaster.mguard	Clean Master_2	Clean Master_2_10	train	will the app keep a record of my photos?	1	0	0	0	0	0	0
../../Dataset/Train/com.cleanmaster.mguard	Clean Master_2	Clean Master_2_11	train	will the app gather other information without telling me?	1	0	0	0	0	0	0
../../Dataset/Train/com.cleanmaster.mguard	Clean Master_2	Clean Master_2_12	train	will the app send or keep information about me?	0	0	0	1	0	0	0
../../Dataset/Train/com.cleanmaster.mguard	Clean Master_2	Clean Master_2_13	train	will the app track my browsing habits?	1	0	0	0	0	0	0
../../Dataset/Train/com.cleanmaster.mguard	Clean Master_2	Clean Master_2_14	train	will the app release my data to third party companies?	0	1	0	0	0	0	0
../../Dataset/Train/com.cleanmaster.mguard	Clean Master_2	Clean Master_2_15	train	does it log my browsing history?	1	0	0	0	0	0	0
../../Dataset/Train/com.cleanmaster.mguard	Clean Master_2	Clean Master_2_16	train	does it log my device information?	1	0	0	0	0	0	0
../../Dataset/Train/com.cleanmaster.mguard	Clean Master_2	Clean Master_2_17	train	do they sell my email to advertisers.	0	1	0	0	0	0	0
../../Dataset/Train/com.cleanmaster.mguard	Clean Master_2	Clean Master_2_18	train	do they store my social media information in a database?	0	0	0	1	0	0	0
../../Dataset/Train/com.cleanmaster.mguard	Clean Master_2	Clean Master_2_19	train	do they have access to view my photos?	1	0	0	0	0	0	0
../../Dataset/Train/com.cleanmaster.mguard	Clean Master_2	Clean Master_2_20	train	does it record what is deleted?	0	0	0	0	0	0	0
../../Dataset/Train/com.cleanmaster.mguard	Clean Master_2	Clean Master_2_21	train	can i use it without an internet connection?	0	0	0	0	0	0	0
../../Dataset/Train/com.cleanmaster.mguard	Clean Master_2	Clean Master_2_22	train	does it have advertisements?	0	1	0	0	0	0	0
../../Dataset/Train/com.cleanmaster.mguard	Clean Master_2	Clean Master_2_23	train	does it do stuff in the background?	0	0	0	0	0	1	0
../../Dataset/Train/com.cleanmaster.mguard	Clean Master_2	Clean Master_2_24	train	does it require an account?	0	0	1	0	0	0	0
../../Dataset/Train/com.cleanmaster.mguard	Clean Master_2	Clean Master_2_25	train	will it store any information on my phone?	0	0	0	1	0	0	0
../../Dataset/Train/com.cleanmaster.mguard	Clean Master_2	Clean Master_2_26	train	will it invade any private info on my phone?	1	0	0	0	0	0	0
../../Dataset/Train/com.cleanmaster.mguard	Clean Master_2	Clean Master_2_27	train	will it ask me for permission before deleting files?	0	0	0	0	0	1	0
../../Dataset/Train/com.cleanmaster.mguard	Clean Master_2	Clean Master_2_28	train	will i get any warning if i feel my phone has a virus?	0	0	0	0	0	0	0
../../Dataset/Train/com.cleanmaster.mguard	Clean Master_2	Clean Master_2_29	train	do you offer safety concerns if someone has questions?	0	0	0	0	0	0	1
../../Dataset/Train/com.cleanmaster.mguard	Clean Master_2	Clean Master_2_30	train	is there a way to verify the privacy claims made by this app?	0	0	0	0	0	0	1
../../Dataset/Train/com.cleanmaster.mguard	Clean Master_2	Clean Master_2_31	train	do they include ads, including potentially malicious ones?	0	0	1	0	0	0	0
../../Dataset/Train/com.cleanmaster.mguard	Clean Master_2	Clean Master_2_32	train	what sort of privacy permissions does the app request?	1	0	0	0	0	0	0
../../Dataset/Train/com.cleanmaster.mguard	Clean Master_2	Clean Master_2_33	train	does this app track usage of other apps on my device?	1	0	0	0	0	0	0
../../Dataset/Train/com.cleanmaster.mguard	Clean Master_2	Clean Master_2_34	train	does it require any sort of login?	0	0	1	0	0	0	0
../../Dataset/Train/com.cleanmaster.mguard	Clean Master_2	Clean Master_2_35	train	what info do you collect?	1	0	0	0	0	0	0
../../Dataset/Train/com.cleanmaster.mguard	Clean Master_2	Clean Master_2_36	train	why do you need to collect information?	1	0	0	0	0	0	0
../../Dataset/Train/com.cleanmaster.mguard	Clean Master_2	Clean Master_2_37	train	will you safeguard my information?	0	0	1	0	0	0	0
../../Dataset/Train/com.cleanmaster.mguard	Clean Master_2	Clean Master_2_38	train	who has access to personal info?	0	1	0	0	0	0	0
../../Dataset/Train/com.cleanmaster.mguard	Clean Master_2	Clean Master_2_39	train	will you need payment info from me?	1	0	0	0	0	0	0
../../Dataset/Train/com.cleanmaster.mguard	Clean Master_2	Clean Master_2_40	train	do they store any of my files.	0	0	0	1	0	0	0
../../Dataset/Train/com.cleanmaster.mguard	Clean Master_2	Clean Master_2_41	train	do they collect information about my name.	1	0	0	0	0	0	0
../../Dataset/Train/com.cleanmaster.mguard	Clean Master_2	Clean Master_2_42	train	do they collect credit card information.	1	0	0	0	0	0	0
../../Dataset/Train/com.cleanmaster.mguard	Clean Master_2	Clean Master_2_43	train	do they collect browsing data.	1	0	0	0	0	0	0
../../Dataset/Train/com.cleanmaster.mguard	Clean Master_2	Clean Master_2_44	train	do they collect any data.	1	0	0	0	0	0	0
../../Dataset/Train/com.cleanmaster.mguard	Clean Master_2	Clean Master_2_45	train	how much of my data is accessed?	1	0	0	0	0	0	0
../../Dataset/Train/com.cleanmaster.mguard	Clean Master_2	Clean Master_2_46	train	can my location be tracked?	1	0	0	0	0	0	0
../../Dataset/Train/com.cleanmaster.mguard	Clean Master_2	Clean Master_2_47	train	is anything not mentioned installed on my phone?	0	0	0	0	0	1	0
../../Dataset/Train/com.cleanmaster.mguard	Clean Master_2	Clean Master_2_48	train	is my data sold to anyone?	0	1	0	0	0	0	0
../../Dataset/Train/com.cleanmaster.mguard	Clean Master_2	Clean Master_2_49	train	is the app 100% safe?	0	0	1	0	0	0	0
../../Dataset/Train/com.cootek.smartinputv5	TouchPal Keyboard _3	TouchPal Keyboard _3_0	train	will this app save any passwords?	1	0	0	0	0	0	0
../../Dataset/Train/com.cootek.smartinputv5	TouchPal Keyboard _3	TouchPal Keyboard _3_1	train	will this app save any words i use in incognito?	1	0	0	0	0	0	0
../../Dataset/Train/com.cootek.smartinputv5	TouchPal Keyboard _3	TouchPal Keyboard _3_2	train	how will this keyboard predict text?	0	0	0	0	0	0	0
../../Dataset/Train/com.cootek.smartinputv5	TouchPal Keyboard _3	TouchPal Keyboard _3_3	train	will this keyboard save and memorize/predict word phrases?	0	0	0	0	0	0	0
../../Dataset/Train/com.cootek.smartinputv5	TouchPal Keyboard _3	TouchPal Keyboard _3_4	train	will this app save credit card numbers?	1	0	0	0	0	0	0
../../Dataset/Train/com.cootek.smartinputv5	TouchPal Keyboard _3	TouchPal Keyboard _3_5	train	what sort of data is collected from me while using this?	1	1	0	0	0	0	0
../../Dataset/Train/com.cootek.smartinputv5	TouchPal Keyboard _3	TouchPal Keyboard _3_6	train	will it share or collect my location?	1	0	0	0	0	0	0
../../Dataset/Train/com.cootek.smartinputv5	TouchPal Keyboard _3	TouchPal Keyboard _3_7	train	will this app show me ads?	1	1	0	0	0	0	0
../../Dataset/Train/com.cootek.smartinputv5	TouchPal Keyboard _3	TouchPal Keyboard _3_8	train	if it does show ads, is there a paid version to disable them?	1	1	0	0	0	0	0
../../Dataset/Train/com.cootek.smartinputv5	TouchPal Keyboard _3	TouchPal Keyboard _3_9	train	does the app post anything on social media that i type etc?	1	1	0	0	0	0	0
../../Dataset/Train/com.cootek.smartinputv5	TouchPal Keyboard _3	TouchPal Keyboard _3_10	train	is what i typed being saved anywhere?	0	0	0	0	0	0	0
../../Dataset/Train/com.cootek.smartinputv5	TouchPal Keyboard _3	TouchPal Keyboard _3_11	train	are keywords used for giving ads to me?	0	0	0	0	0	0	0
../../Dataset/Train/com.cootek.smartinputv5	TouchPal Keyboard _3	TouchPal Keyboard _3_12	train	is my data given to any third parties?	1	1	0	0	0	0	0
../../Dataset/Train/com.cootek.smartinputv5	TouchPal Keyboard _3	TouchPal Keyboard _3_13	train	is my data sold to any third parties?	1	1	0	0	0	0	0
../../Dataset/Train/com.cootek.smartinputv5	TouchPal Keyboard _3	TouchPal Keyboard _3_14	train	how long is any data saved held for?	0	0	0	1	0	0	0
../../Dataset/Train/com.cootek.smartinputv5	TouchPal Keyboard _3	TouchPal Keyboard _3_15	train	will the things that i type using the glide typing be saved or sent to anyone or any company?	1	1	0	0	0	0	0
../../Dataset/Train/com.cootek.smartinputv5	TouchPal Keyboard _3	TouchPal Keyboard _3_16	train	will the it-voice typing feature save any of hte things i say to it?	1	0	0	0	0	0	0
../../Dataset/Train/com.cootek.smartinputv5	TouchPal Keyboard _3	TouchPal Keyboard _3_17	train	how will the information i use this app for be used?	1	1	0	0	0	0	0
../../Dataset/Train/com.cootek.smartinputv5	TouchPal Keyboard _3	TouchPal Keyboard _3_18	train	will the things i type and say with this app be sold or kept by the app developer?	1	1	0	0	0	0	0
../../Dataset/Train/com.cootek.smartinputv5	TouchPal Keyboard _3	TouchPal Keyboard _3_19	train	how is my information i provide to this app safe-guarded?	0	0	1	0	0	0	0
../../Dataset/Train/com.cootek.smartinputv5	TouchPal Keyboard _3	TouchPal Keyboard _3_20	train	does it record and save my text	0	0	0	0	0	0	0
../../Dataset/Train/com.cootek.smartinputv5	TouchPal Keyboard _3	TouchPal Keyboard _3_21	train	are their any 3rd part ads displayed	1	1	0	0	0	0	0
../../Dataset/Train/com.cootek.smartinputv5	TouchPal Keyboard _3	TouchPal Keyboard _3_22	train	what permissions does it require	1	0	0	0	0	1	0
../../Dataset/Train/com.cootek.smartinputv5	TouchPal Keyboard _3	TouchPal Keyboard _3_23	train	does it send log files back to the developer	1	1	0	0	0	0	0
../../Dataset/Train/com.cootek.smartinputv5	TouchPal Keyboard _3	TouchPal Keyboard _3_24	train	does the developer sell data acquired from it users	1	1	0	0	0	0	0
../../Dataset/Train/com.cootek.smartinputv5	TouchPal Keyboard _3	TouchPal Keyboard _3_25	train	will it save everything i ever type?	0	0	0	0	0	0	0
../../Dataset/Train/com.cootek.smartinputv5	TouchPal Keyboard _3	TouchPal Keyboard _3_26	train	if so, can companies buy my info?	1	1	0	0	0	0	0
../../Dataset/Train/com.cootek.smartinputv5	TouchPal Keyboard _3	TouchPal Keyboard _3_27	train	do you have access to my contacts?	1	0	0	0	0	0	0
../../Dataset/Train/com.cootek.smartinputv5	TouchPal Keyboard _3	TouchPal Keyboard _3_28	train	can you read my text messages since i am using your app to text?	0	0	0	0	0	0	0
../../Dataset/Train/com.cootek.smartinputv5	TouchPal Keyboard _3	TouchPal Keyboard _3_29	train	if any of the questions above are a 'yes'. is there a way to turn that off?	0	0	0	0	0	1	0
../../Dataset/Train/com.cootek.smartinputv5	TouchPal Keyboard _3	TouchPal Keyboard _3_30	train	which permissions does the app require and what does it use those permissions to do?	1	0	0	0	0	1	0
../../Dataset/Train/com.cootek.smartinputv5	TouchPal Keyboard _3	TouchPal Keyboard _3_31	train	does the app log any of the input provided by the touchscreen keyboard?	0	0	0	0	0	0	0
../../Dataset/Train/com.cootek.smartinputv5	TouchPal Keyboard _3	TouchPal Keyboard _3_32	train	"does the app \phone home\"" at any point and if so, why?"""	0	0	0	0	0	0	1
../../Dataset/Train/com.cootek.smartinputv5	TouchPal Keyboard _3	TouchPal Keyboard _3_33	train	does the app install anything other than that which is necessary to operate the features described in the description?	0	0	0	0	0	0	0
../../Dataset/Train/com.cootek.smartinputv5	TouchPal Keyboard _3	TouchPal Keyboard _3_34	train	does the app provide an attack vector for stealing the content of text messaging, emails, and the like?	0	0	0	0	0	0	0
../../Dataset/Train/com.cootek.smartinputv5	TouchPal Keyboard _3	TouchPal Keyboard _3_35	train	does this app log what i typed?	0	0	0	0	0	0	0
../../Dataset/Train/com.cootek.smartinputv5	TouchPal Keyboard _3	TouchPal Keyboard _3_36	train	what data does this app have access to on my phone?	1	1	0	0	0	0	0
../../Dataset/Train/com.cootek.smartinputv5	TouchPal Keyboard _3	TouchPal Keyboard _3_37	train	what steps does this developer take to make sure my data they collected is secured?	0	0	1	0	0	0	0
../../Dataset/Train/com.cootek.smartinputv5	TouchPal Keyboard _3	TouchPal Keyboard _3_38	train	do they share or sell my data to a third party?	1	1	0	0	0	0	0
../../Dataset/Train/com.cootek.smartinputv5	TouchPal Keyboard _3	TouchPal Keyboard _3_39	train	how long will they keep my data?	0	0	0	1	0	0	0
../../Dataset/Train/com.cootek.smartinputv5	TouchPal Keyboard _3	TouchPal Keyboard _3_40	train	does the predictive typing feature require constant transmission of data to a third party/server?	1	1	0	0	0	0	0
../../Dataset/Train/com.cootek.smartinputv5	TouchPal Keyboard _3	TouchPal Keyboard _3_41	train	is there anyway this app could be exploited as a keylogger?	0	0	1	0	0	0	0
../../Dataset/Train/com.cootek.smartinputv5	TouchPal Keyboard _3	TouchPal Keyboard _3_42	train	is the stuff i type stored on a server?	0	0	0	0	0	0	0
../../Dataset/Train/com.cootek.smartinputv5	TouchPal Keyboard _3	TouchPal Keyboard _3_43	train	how long is data procured from me stored?	0	0	0	1	0	0	0
../../Dataset/Train/com.cootek.smartinputv5	TouchPal Keyboard _3	TouchPal Keyboard _3_44	train	will any of my identifying information/stuff i type be accessed or available to be accessed by third party entities?	1	1	0	0	0	0	0
../../Dataset/Train/com.cootek.smartinputv5	TouchPal Keyboard _3	TouchPal Keyboard _3_45	train	will others be able to see when i use this app?	1	0	0	0	0	0	0
../../Dataset/Train/com.cootek.smartinputv5	TouchPal Keyboard _3	TouchPal Keyboard _3_46	train	if i share a device with others and use this app can they see information that i type on this?	0	0	0	0	0	0	1
../../Dataset/Train/com.cootek.smartinputv5	TouchPal Keyboard _3	TouchPal Keyboard _3_47	train	is my data secure that i use on this app?	0	0	1	0	0	0	0
../../Dataset/Train/com.cootek.smartinputv5	TouchPal Keyboard _3	TouchPal Keyboard _3_48	train	are there any safety concerns i should know about using this app?	0	0	1	0	0	0	0
../../Dataset/Train/com.cootek.smartinputv5	TouchPal Keyboard _3	TouchPal Keyboard _3_49	train	is it safe to use credit card information using this app?	0	0	1	0	0	0	0
../../Dataset/Train/com.evernote	Evernote _4	Evernote _4_0	train	does it let other people see your notes?	0	0	0	0	0	1	0
../../Dataset/Train/com.evernote	Evernote _4	Evernote _4_1	train	are you able to share your notes?	0	0	0	0	0	1	0
../../Dataset/Train/com.evernote	Evernote _4	Evernote _4_2	train	does it tell you what the app uses (gps, etc.)?	1	0	0	0	0	1	0
../../Dataset/Train/com.evernote	Evernote _4	Evernote _4_3	train	is there a privacy policy to read?	0	0	0	0	0	0	1
../../Dataset/Train/com.evernote	Evernote _4	Evernote _4_4	train	how private is this app?	0	1	0	0	0	0	0
../../Dataset/Train/com.evernote	Evernote _4	Evernote _4_5	train	will my photos be sold to facebook?	0	1	0	0	0	0	0
../../Dataset/Train/com.evernote	Evernote _4	Evernote _4_6	train	will my notes be sold to advertisers?	0	1	0	0	0	0	0
../../Dataset/Train/com.evernote	Evernote _4	Evernote _4_7	train	is there 2-step verification in case somebody logs in from a different device?	0	0	1	0	0	0	0
../../Dataset/Train/com.evernote	Evernote _4	Evernote _4_8	train	will my documents be sold to facebook?	0	1	0	0	0	0	0
../../Dataset/Train/com.evernote	Evernote _4	Evernote _4_9	train	will my sketches be sold to facebook?	0	1	0	0	0	0	0
../../Dataset/Train/com.evernote	Evernote _4	Evernote _4_10	train	will you do anything to my phone without my knowledge	1	0	0	0	0	1	0
../../Dataset/Train/com.evernote	Evernote _4	Evernote _4_11	train	do you keep my location data	1	0	0	0	0	0	0
../../Dataset/Train/com.evernote	Evernote _4	Evernote _4_12	train	do you use my date to modify the app	1	0	0	0	0	1	0
../../Dataset/Train/com.evernote	Evernote _4	Evernote _4_13	train	do you sell my data	0	1	0	0	0	0	0
../../Dataset/Train/com.evernote	Evernote _4	Evernote _4_14	train	do you keep my data and upload to your server	0	0	1	1	0	0	0
../../Dataset/Train/com.evernote	Evernote _4	Evernote _4_15	train	are my notes encrypted?	0	0	1	0	0	0	0
../../Dataset/Train/com.evernote	Evernote _4	Evernote _4_16	train	can i use my own private key on my notes?	0	0	1	0	0	0	0
../../Dataset/Train/com.evernote	Evernote _4	Evernote _4_17	train	does the app do anything in the background?	1	0	0	0	0	1	0
../../Dataset/Train/com.evernote	Evernote _4	Evernote _4_18	train	can i use it without an account?	1	0	0	0	0	0	0
../../Dataset/Train/com.evernote	Evernote _4	Evernote _4_19	train	does it share data with third parties?	0	1	0	0	0	0	0
../../Dataset/Train/com.evernote	Evernote _4	Evernote _4_20	train	will it be able to access my location?	1	0	0	0	0	0	0
../../Dataset/Train/com.evernote	Evernote _4	Evernote _4_21	train	does it store my history?	0	0	0	1	1	0	0
../../Dataset/Train/com.evernote	Evernote _4	Evernote _4_22	train	can other members see my real name?	0	0	0	0	0	1	0
../../Dataset/Train/com.evernote	Evernote _4	Evernote _4_23	train	will my password be stored safely?	0	0	1	0	0	0	0
../../Dataset/Train/com.evernote	Evernote _4	Evernote _4_24	train	can it see how often i access the notes?	1	0	0	0	0	0	0
../../Dataset/Train/com.evernote	Evernote _4	Evernote _4_25	train	are my notes stored in the app server forever?	0	0	0	1	1	0	0
../../Dataset/Train/com.evernote	Evernote _4	Evernote _4_26	train	does ever note stores what it reads to a server or is it in the phone only?	0	0	1	1	0	0	0
